Тип партнера,Наименование партнера,Директор,Электронная почта партнера,Телефон партнера,Юридический адрес партнера,ИНН,Рейтинг
ЗАО,База Строитель,Иванова Александра Ивановна,aleksandr.ivanova@ml.ru,493 123 45 67,"652050, Кемеровская обл., Юрга, ул. Лесная, 15",2222455179,7
ООО,Паркет 29,Петров Василий Петрович,vppetrov@vl.ru,987 123 56 78,"164500, Архангельская обл., Северодвинск, ул. Строителей",3333888520,7
ПАО,Стройсервис	Соловьев,Андрей Николаевич,nsolovev@st.ru,812 223 32 00,"188910,Ленинградская область, город Приморск, ул. Парковая",214440391035,7
ОАО,Ремонт и отделка,Воробьева Екатерина Валерьевна,ekaterina.vorobeva@ml.ru,444 222 33 11,"143960, Московская область, город Реутов, ул. Свободы",511111520857,5
ЗАО,МонтажПро,Степанов Степан Сергеевич,stepanov@stepan.ru,912 888 33 33,"309500, Белгородская область, город Старый Оскол, ул. Рабочая",1225552431140,10